{
  "$schema": "../schemas/deployment-metrics.schema.json",
  "version": "1.0.0",
  "lastUpdated": "2026-01-27T00:00:00Z",
  "watchtowerStatus": {
    "operational": true,
    "pollInterval": 300,
    "lastCheck": "2026-01-27T00:00:00Z",
    "notificationsEnabled": true,
    "httpApiEnabled": true,
    "metricsEndpoint": "http://watchtower:8080/v1/metrics"
  },
  "environments": {
    "staging": {
      "services": {
        "api": {
          "image": "ghcr.io/luh-tech/venture-api:staging",
          "imageDigest": "sha256:0000000000000000000000000000000000000000000000000000000000000000",
          "tag": "staging",
          "commitSha": "0000000000000000000000000000000000000000",
          "status": "healthy",
          "deployedAt": "2026-01-27T00:00:00Z",
          "deployedBy": "watchtower",
          "uptime": "2h 15m",
          "healthScore": 100,
          "restartCount": 0
        },
        "web": {
          "image": "ghcr.io/luh-tech/venture-web:staging",
          "imageDigest": "sha256:0000000000000000000000000000000000000000000000000000000000000000",
          "tag": "staging",
          "status": "healthy",
          "deployedAt": "2026-01-27T00:00:00Z",
          "deployedBy": "watchtower",
          "uptime": "2h 15m",
          "healthScore": 100,
          "restartCount": 0
        }
      },
      "lastDeployment": {
        "timestamp": "2026-01-27T00:00:00Z",
        "commitSha": "0000000000000000000000000000000000000000",
        "status": "success",
        "triggeredBy": "watchtower-poll",
        "servicesUpdated": ["api", "web"],
        "duration": 120
      },
      "statistics": {
        "totalDeployments": 100,
        "successfulDeployments": 98,
        "failedDeployments": 2,
        "successRate": 98.0,
        "averageDeploymentTime": 90,
        "deploymentsLast24h": 5,
        "deploymentsLast7d": 25,
        "lastSuccess": "2026-01-27T00:00:00Z",
        "lastFailure": "2026-01-20T00:00:00Z"
      }
    },
    "production": {
      "services": {
        "api": {
          "image": "ghcr.io/luh-tech/venture-api:latest",
          "imageDigest": "sha256:0000000000000000000000000000000000000000000000000000000000000000",
          "tag": "latest",
          "commitSha": "0000000000000000000000000000000000000000",
          "status": "healthy",
          "deployedAt": "2026-01-26T00:00:00Z",
          "deployedBy": "watchtower",
          "uptime": "26h 15m",
          "healthScore": 100,
          "restartCount": 0
        },
        "web": {
          "image": "ghcr.io/luh-tech/venture-web:latest",
          "imageDigest": "sha256:0000000000000000000000000000000000000000000000000000000000000000",
          "tag": "latest",
          "status": "healthy",
          "deployedAt": "2026-01-26T00:00:00Z",
          "deployedBy": "watchtower",
          "uptime": "26h 15m",
          "healthScore": 100,
          "restartCount": 0
        }
      },
      "lastDeployment": {
        "timestamp": "2026-01-26T00:00:00Z",
        "commitSha": "0000000000000000000000000000000000000000",
        "status": "success",
        "triggeredBy": "watchtower-poll",
        "servicesUpdated": ["api", "web"],
        "duration": 150
      },
      "statistics": {
        "totalDeployments": 50,
        "successfulDeployments": 49,
        "failedDeployments": 1,
        "successRate": 98.0,
        "averageDeploymentTime": 120,
        "deploymentsLast24h": 1,
        "deploymentsLast7d": 7,
        "lastSuccess": "2026-01-26T00:00:00Z",
        "lastFailure": "2026-01-10T00:00:00Z"
      }
    }
  }
}
